question,answer
1. EV 충전소란?,"EV 충전소는 전기 자동차의 에너지 보충 지점으로, 전통적인 자동차의 주유소와 유사합니다. 레벨 1(표준 콘센트), 레벨 2(더 빠르고 일반적으로 240V), DC 고속 충전기(장거리 여행에 가장 빠름) 등 다양한 유형이 있습니다."
2. 전기 자동차를 충전하는 데 얼마나 걸리나요?,"충전 시간은 충전기 유형과 차량 배터리 용량에 따라 다릅니다. 레벨 1 충전기는 완전히 충전하는 데 8~12시간이 걸리고 레벨 2 충전기는 일반적으로 4~6시간이 걸리는 반면, DC 급속 충전기 약 80분에서 30시간 안에 2%까지 충전할 수 있습니다."
3. 모든 EV 모델에 충전소가 있나요?,대부분의 레벨 1 및 레벨 2 충전기는 모든 EV 모델과 호환됩니다. 그러나 일부 고속 충전기에는 특정 커넥터 또는 어댑터가 필요할 수 있습니다. 차량 사용 설명서 또는 충전소 정보와의 호환성을 확인하는 것이 좋습니다.
4. 전기차 충전 비용은 어떻게 지불하나요?,"결제 옵션은 주유소마다 다릅니다. 일부 충전소는 무료이며, 내 근처의 무료 EV 충전소를 검색하여 찾을 수 있습니다. 다른 충전소는 구독 또는 선불 옵션이 필요합니다. 일반적으로 모바일 앱, 신용카드 또는 신용 카드로 결제할 수 있습니다."
5. 집에서 EV를 충전할 수 있나요?,"그렇습니다, 당신은 할 수있다 집에 EV 충전소 설치 그때 표준 전기 콘센트에 꽂는 레벨 1 충전기를 사용하여 집에서 EV를 충전할 수 있습니다. 집에서 더 빠르게 충전하려면 전문적인 설치 및 특수 회로가 필요한 레벨 2 충전기를 설치할 수 있습니다."
6. EV 충전소의 미래는 어떻게 될까요?,"태양광 충전소, 무선 충전 기술의 발전, 도로에서 증가하는 전기 자동차를 지원하기 위한 충전 인프라 확대로 인해 EV 충전의 미래는 밝아지고 있습니다."
7. 내 근처의 충전소를 어떻게 찾을 수 있나요?,"모바일 앱을 사용하여 충전소를 찾을 수 있으며, Google, 온라인 지도 또는 차량 내비게이션 시스템을 통해 EV 충전소에 가장 적합한 앱을 찾을 수 있습니다. 많은 전기 자동차에는 근처 충전소를 보여주는 내장형 내비게이션이 장착되어 있습니다."
8. EV 충전소는 환경 친화적인가요?,EV 충전소는 전기 자동차 사용을 지원하여 온실 가스 배출을 줄이는 데 도움이 됩니다. 또한 많은 충전소가 태양광 및 풍력과 같은 재생 에너지원을 탐색하고 있습니다.
9. 충전 케이블에는 어떤 종류가 있나요?,충전 케이블은 일반적으로 두 가지 유형으로 제공됩니다. 충전 포트에 꽂는 전도성 충전 케이블과 무선 충전을 위한 유도성 충전 패드입니다. 필요한 케이블 유형은 차량과 충전소에서 지원하는 충전 시스템에 따라 달라집니다.
10. OCPP란 무엇입니까?,"OCPP Open Charge Point Protocol의 약자로, 일반적으로 EV 충전소로 알려진 전기 자동차 구동 장비(EVSE)를 위해 설계된 개방형 표준 통신 프로토콜입니다. 충전소와 충전 네트워크 관리 시스템 간의 통신을 용이하게 하여 충전 인프라의 효율적인 관리 및 운영을 가능하게 합니다."
